{"claimBoundary":{"causalInference":"notEvaluated","confirmatoryGate":"notApplicableCannotRescueH6","h6Result":"immutableNegativeResultNotRescued","interpretation":"assuranceAndReadinessDecisionOnly","policySelection":"notPerformed","populationInference":"notEvaluatedNoCiOrPValue"},"closureInput":{"auditReceipt":{"lengthBytes":25437,"path":"E:\\RideBoundData\\wp13\\wp13-full-source-logic-claim-audit-v1.json","sha256":"cd8639884fc2c421a15e137b21522cde3b2fcc80f9b7eebbdcc2454b373fad76"},"deepVerification":{"e1ArmRunCount":80,"e1PortfolioCount":44156,"e1RequestCount":8640,"e1SolverDecisionCount":44156,"h6BundleCount":100,"h6SolverDecisionCount":57806},"evidenceDag":{"activeArtifactCount":10,"failedEdgeCount":0,"supersededArtifactCount":3},"repositoryInventory":{"fileCount":80,"sha256":"33d89c17caf1596ef943cd2714bacdfd820c33ca266d2cf2bef3efe5371010c4","totalBytes":1076880}},"exitGates":{"architecture":{"evidence":"45 Domain/Application files and 115 analyzer imports; zero reverse dependency violations or simulator-policy reimplementation detected","verdict":"pass"},"claimBoundary":{"evidence":"12 stable documents, 24 caveat/prohibited occurrences, zero unsafe conclusions; exact noncausal/non-additive/incomparable labels present","verdict":"pass"},"provenance":{"evidence":"10 active and 3 superseded external artifacts resolve exact length/SHA; 62/62 E1 freeze repository files match","verdict":"pass"},"rawImmutability":{"evidence":"H6/E1 deep verification is read-only; no raw-root output; retention policy forbids delete, move, rewrite, or recompression in closure","verdict":"pass"},"resourceReadiness":{"evidence":"5.516 GB E1 is retained and frozen; WP14 requires staged dry-run plus declared disk/runtime envelope before execution","verdict":"pass"},"sourceLogicClaimAudit":{"evidence":"RB-WP13-012 closed with zero unresolved P0/P1/P2 after supplemental verifier guard and mutation regression","verdict":"pass"},"wp14Separation":{"evidence":"WP14 is restricted to a new development namespace/cells, excludes H6 panels from selection, and requires freeze before outcome","verdict":"pass"}},"p3Resolutions":[{"findingId":"WP13-AUDIT-P3-001","owner":"RB-WP13-013","resolution":"Future derived success outputs require raw-root rejection, write-after-verify canonical serialization, exclusive create, and explicit supersession metadata","status":"resolvedByClosurePolicy"},{"findingId":"WP13-AUDIT-P3-002","owner":"RB-WP13-013","resolution":"Retain and freeze all 5,516,098,710 verified E1 bytes; no archive/delete action in WP13; any future migration requires byte-exact dual inventory before cutover","status":"resolvedByClosurePolicy"},{"findingId":"WP13-AUDIT-P3-003","owner":"RB-WP13-013","resolution":"Preserve the frozen E1 verifier hash; future execution requires a versioned successor with canonical-integer, optional-field, UTF-8 identifier, strict-schema, and regression guards","status":"resolvedByClosurePolicy"}],"reportType":"ridebound-wp13-closure-decision-v1","retentionPolicy":{"archiveAction":"notPerformed","deletionPermitted":false,"disposition":"retainVerifiedRawAndFreeze","futureMigrationRule":"byteExactDualInventoryBeforeCutover","verifiedRawBytes":5516098710},"schemaId":"https://ridebound.local/schemas/wp13/v1/closure-decision.schema.json","schemaVersion":"1.0.0","sourceIdentity":{"auditSchemaSha256":"323aec7a2bc34fdc61fa9bce9287f64361f958c1d4b7d70eec760442999a0ea4","policyDocument":{"lengthBytes":3751,"path":"docs/benchmarking/wp13-evidence-retention-and-successor-policy-v1.md","sha256":"fe10a9bef62cffa8974c65900e561a56f26ab200cb4ba48c663e2d8bb91e656e"},"schemaSha256":"a4cbfb1438b672f10ea976b9abfe56af10617de2ba37a96b178ac618c9bffaca"},"successorVerifierPolicy":{"canonicalIntegerGuard":"requiredBooleanIsNotInteger","exclusiveCreate":"requiredForSuccessArtifacts","frozenVerifierMutation":"forbidden","futureVerifier":"versionedSuccessorRequired","optionalFieldGuard":"requiredTypeOrOmissionNoNull","utf8IdentifierGuard":"requiredOneTo128Bytes"},"verification":{"dotNetPassed":860,"independentClosureTestsPassed":6,"pinnedPythonPassed":205,"unresolvedFindingCount":0},"wp14Decision":{"constraints":["newDevelopmentNamespaceAndCells","h6PanelsExcludedFromConfigurationSelection","freezeBeforeOutcome","pairedParetoReportNoScalarPostOutcomeSelection","declaredDiskAndRuntimeEnvelope","noH7OrPolicyV2Authorization"],"nextTicket":"RB-WP14-001","nextWorkPackage":"WP14","verdict":"openExploratoryAblationOnly"}}
